### ISSUE TITLE
Front50 Socket Timeout after upgrading to 1.3.1

### ISSUE THREAD

**Issue by bernardoVale** [spinnaker/spinnaker#2026]
*Front50 Socket Timeout after upgrading to 1.3.1*

*Cloud Provider*

Kubernetes,Azure

*Environment*

Running local-debian setup on Azure

*Feature Area*

Front50/Gate

*Description*

The application is unresponsive after upgrading to 1.3.1.

Gate is getting a timeout while trying to fetch app information.

```
2017-10-11 13:17:57.034  INFO 1822 --- [-applications-9] c.n.s.g.s.internal.Front50Service        : ---- ERROR http://localhost:8080/v2/applications
2017-10-11 13:17:57.035  INFO 1822 --- [-applications-9] c.n.s.g.s.internal.Front50Service        : java.net.SocketTimeoutException: timeout
```

*Steps to Reproduce*

- Upgrade to 1.3.1
- Wait startup
- `curl http://localhost:8080/v2/applications`

*Additional Details*

**gate.log**
```
2017-10-11 13:17:57.034  INFO 1822 --- [-applications-9] c.n.s.g.s.internal.Front50Service        : ---- ERROR http://localhost:8080/v2/applications
2017-10-11 13:17:57.035  INFO 1822 --- [-applications-9] c.n.s.g.s.internal.Front50Service        : java.net.SocketTimeoutException: timeout
	at okio.Okio$3.newTimeoutException(Okio.java:207)
	at okio.AsyncTimeout.exit(AsyncTimeout.java:261)
	at okio.AsyncTimeout$2.read(AsyncTimeout.java:215)
	at okio.RealBufferedSource.indexOf(RealBufferedSource.java:306)
	at okio.RealBufferedSource.indexOf(RealBufferedSource.java:300)
	at okio.RealBufferedSource.readUtf8LineStrict(RealBufferedSource.java:196)
	at com.squareup.okhttp.internal.http.Http1xStream.readResponse(Http1xStream.java:186)
	at com.squareup.okhttp.internal.http.Http1xStream.readResponseHeaders(Http1xStream.java:127)
	at com.squareup.okhttp.internal.http.HttpEngine.readNetworkResponse(HttpEngine.java:739)
	at com.squareup.okhttp.internal.http.HttpEngine.access$200(HttpEngine.java:87)
	at com.squareup.okhttp.internal.http.HttpEngine$NetworkInterceptorChain.proceed(HttpEngine.java:724)
	at com.squareup.okhttp.internal.http.HttpEngine.readResponse(HttpEngine.java:578)
	at com.squareup.okhttp.Call.getResponse(Call.java:287)
	at com.squareup.okhttp.Call$ApplicationInterceptorChain.proceed(Call.java:243)
	at com.squareup.okhttp.Call.getResponseWithInterceptorChain(Call.java:205)
	at com.squareup.okhttp.Call.execute(Call.java:80)
	at retrofit.client.OkClient.execute(OkClient.java:53)
	at com.netflix.spinnaker.gate.retrofit.EurekaOkClient.super$2$execute(EurekaOkClient.groovy)
	at sun.reflect.NativeMethodAccessorImpl.invoke0(Native Method)
	at sun.reflect.NativeMethodAccessorImpl.invoke(NativeMethodAccessorImpl.java:62)
	at sun.reflect.DelegatingMethodAccessorImpl.invoke(DelegatingMethodAccessorImpl.java:43)
	at java.lang.reflect.Method.invoke(Method.java:498)
	at org.codehaus.groovy.reflection.CachedMethod.invoke(CachedMethod.java:93)
	at groovy.lang.MetaMethod.doMethodInvoke(MetaMethod.java:325)
	at groovy.lang.MetaClassImpl.invokeMethod(MetaClassImpl.java:1213)
	at org.codehaus.groovy.runtime.ScriptBytecodeAdapter.invokeMethodOnSuperN(ScriptBytecodeAdapter.java:132)
	at com.netflix.spinnaker.gate.retrofit.EurekaOkClient.execute(EurekaOkClient.groovy:82)
	at retrofit.RestAdapter$RestHandler.invokeRequest(RestAdapter.java:326)
	at retrofit.RestAdapter$RestHandler.invoke(RestAdapter.java:240)
	at com.sun.proxy.$Proxy104.getAllApplications(Unknown Source)
	at com.netflix.spinnaker.gate.services.ApplicationService$Front50ApplicationListRetriever$_call_closure1$_closure3.doCall(ApplicationService.groovy:272)
	at com.netflix.spinnaker.gate.services.ApplicationService$Front50ApplicationListRetriever$_call_closure1$_closure3.call(ApplicationService.groovy)
	at com.netflix.spinnaker.security.AuthenticatedRequest.lambda$propagate$1(AuthenticatedRequest.java:69)
	at com.netflix.spinnaker.gate.services.ApplicationService$Front50ApplicationListRetriever$_call_closure1.doCall(ApplicationService.groovy:270)
	at com.netflix.spinnaker.gate.services.ApplicationService$Front50ApplicationListRetriever$_call_closure1.call(ApplicationService.groovy)
	at com.netflix.spinnaker.security.AuthenticatedRequest.lambda$propagate$0(AuthenticatedRequest.java:55)
	at com.netflix.spinnaker.gate.services.commands.AbstractHystrixCommand.run(AbstractHystrixCommand.groovy:56)
	at com.netflix.hystrix.HystrixCommand$1.call(HystrixCommand.java:294)
	at com.netflix.hystrix.HystrixCommand$1.call(HystrixCommand.java:289)
	at rx.Observable$2.call(Observable.java:162)
	at rx.Observable$2.call(Observable.java:154)
	at rx.Observable$2.call(Observable.java:162)
	at rx.Observable$2.call(Observable.java:154)
	at rx.Observable$2.call(Observable.java:162)
	at rx.Observable$2.call(Observable.java:154)
	at rx.Observable.unsafeSubscribe(Observable.java:8171)
	at com.netflix.hystrix.AbstractCommand$5.call(AbstractCommand.java:520)
	at com.netflix.hystrix.AbstractCommand$5.call(AbstractCommand.java:495)
	at rx.Observable.unsafeSubscribe(Observable.java:8171)
	at rx.internal.operators.OperatorSubscribeOn$1$1.call(OperatorSubscribeOn.java:62)
	at com.netflix.hystrix.strategy.concurrency.HystrixContexSchedulerAction$1.call(HystrixContexSchedulerAction.java:56)
	at com.netflix.hystrix.strategy.concurrency.HystrixContexSchedulerAction$1.call(HystrixContexSchedulerAction.java:47)
	at com.netflix.hystrix.strategy.concurrency.HystrixContexSchedulerAction.call(HystrixContexSchedulerAction.java:69)
	at rx.internal.schedulers.ScheduledAction.run(ScheduledAction.java:55)
	at java.util.concurrent.Executors$RunnableAdapter.call(Executors.java:511)
	at java.util.concurrent.FutureTask.run(FutureTask.java:266)
	at java.util.concurrent.ThreadPoolExecutor.runWorker(ThreadPoolExecutor.java:1149)
	at java.util.concurrent.ThreadPoolExecutor$Worker.run(ThreadPoolExecutor.java:624)
	at java.lang.Thread.run(Thread.java:748)
Caused by: java.net.SocketException: Socket closed
	at java.net.SocketInputStream.read(SocketInputStream.java:204)
	at java.net.SocketInputStream.read(SocketInputStream.java:141)
	at okio.Okio$2.read(Okio.java:139)
	at okio.AsyncTimeout$2.read(AsyncTimeout.java:211)
	... 56 more
```

**Comment by ttomsu** [comment]
Is Front50 up? Are these just transient errors when trying to boot the whole system up? Since the whole thing has a microservice architecture, we occasionally see startup errors because different components are ready to accept requests at different times.

**Comment by bernardoVale** [comment]
Yep. Both up!

**Comment by ttomsu** [comment]
I suggest hitting that Front50 URL from within the Front50 container. Does it take a long time? Basically - is Gate hitting that timeout because that timeout is too low or is the call actually taking a long time? It's not unheard of for the underlying storage provider to be slow in responding to a Front50 request (which in turn makes Front50 slow)

**Comment by hyunto** [comment]
I also have same issue.
I installed spinnaker 1.4.2 using halyard on the virtual machine for test.

This is my halyard configurations : 
- deploy type : localdebian
- clouddriver : azure
- storage : redis
- ci : jenkins

I got socket timeout exception messages on gate, orca and echo services.
That services have a dependency with front50.
I think that front50 doesn't response anything at all.

**gate.log**
`2017-10-18 09:33:30.113  INFO 2533 --- [-applications-7] c.n.s.g.s.internal.Front50Service        : ---> HTTP GET http://localhost:8080/v2/applications
2017-10-18 09:33:30.115  INFO 2533 --- [-applications-9] c.n.s.g.s.internal.ClouddriverService    : ---> HTTP GET http://localhost:7002/applications?expand=true
2017-10-18 09:33:30.118  INFO 2533 --- [-applications-9] c.n.s.g.s.internal.ClouddriverService    : <--- HTTP 200 http://localhost:7002/applications?expand=true (3ms)
2017-10-18 09:33:34.887  INFO 2533 --- [0.0-8084-exec-5] c.n.s.g.services.internal.OrcaService    : ---> HTTP GET http://localhost:8083/webhooks/preconfigured
2017-10-18 09:33:34.891  INFO 2533 --- [-credentials-10] c.n.s.g.s.internal.ClouddriverService    : ---> HTTP GET http://localhost:7002/credentials
2017-10-18 09:33:34.898  INFO 2533 --- [-credentials-10] c.n.s.g.s.internal.ClouddriverService    : <--- HTTP 200 http://localhost:7002/credentials (4ms)
2017-10-18 09:33:34.901  INFO 2533 --- [-applications-9] c.n.s.g.s.internal.Front50Service        : ---> HTTP GET http://localhost:8080/v2/applications
2017-10-18 09:33:34.905  INFO 2533 --- [applications-10] c.n.s.g.s.internal.ClouddriverService    : ---> HTTP GET http://localhost:7002/applications?expand=false
2017-10-18 09:33:34.909  INFO 2533 --- [applications-10] c.n.s.g.s.internal.ClouddriverService    : <--- HTTP 200 http://localhost:7002/applications?expand=false (3ms)
2017-10-18 09:33:34.925  INFO 2533 --- [0.0-8084-exec-5] c.n.s.g.services.internal.OrcaService    : <--- HTTP 200 http://localhost:8083/webhooks/preconfigured (25ms)
2017-10-18 09:33:38.168  INFO 2533 --- [-credentials-10] c.n.s.g.s.internal.ClouddriverService    : ---> HTTP GET http://localhost:7002/credentials
2017-10-18 09:33:38.170  INFO 2533 --- [-credentials-10] c.n.s.g.s.internal.ClouddriverService    : <--- HTTP 200 http://localhost:7002/credentials (1ms)
2017-10-18 09:33:50.116  INFO 2533 --- [-applications-7] c.n.s.g.s.internal.Front50Service        : ---- ERROR http://localhost:8080/v2/applications
2017-10-18 09:33:50.116  INFO 2533 --- [-applications-7] c.n.s.g.s.internal.Front50Service        : java.net.SocketTimeoutException: timeout
	at okio.Okio$3.newTimeoutException(Okio.java:207)
	at okio.AsyncTimeout.exit(AsyncTimeout.java:261)
	at okio.AsyncTimeout$2.read(AsyncTimeout.java:215)
	at okio.RealBufferedSource.indexOf(RealBufferedSource.java:306)
	at okio.RealBufferedSource.indexOf(RealBufferedSource.java:300)
	at okio.RealBufferedSource.readUtf8LineStrict(RealBufferedSource.java:196)
	at com.squareup.okhttp.internal.http.Http1xStream.readResponse(Http1xStream.java:186)
	at com.squareup.okhttp.internal.http.Http1xStream.readResponseHeaders(Http1xStream.java:127)
	at com.squareup.okhttp.internal.http.HttpEngine.readNetworkResponse(HttpEngine.java:739)
	at com.squareup.okhttp.internal.http.HttpEngine.access$200(HttpEngine.java:87)
	at com.squareup.okhttp.internal.http.HttpEngine$NetworkInterceptorChain.proceed(HttpEngine.java:724)
	at com.squareup.okhttp.internal.http.HttpEngine.readResponse(HttpEngine.java:578)
	at com.squareup.okhttp.Call.getResponse(Call.java:287)
	at com.squareup.okhttp.Call$ApplicationInterceptorChain.proceed(Call.java:243)
	at com.squareup.okhttp.Call.getResponseWithInterceptorChain(Call.java:205)
	at com.squareup.okhttp.Call.execute(Call.java:80)
	at retrofit.client.OkClient.execute(OkClient.java:53)
	at com.netflix.spinnaker.gate.retrofit.EurekaOkClient.super$2$execute(EurekaOkClient.groovy)
	at sun.reflect.GeneratedMethodAccessor136.invoke(Unknown Source)
	at sun.reflect.DelegatingMethodAccessorImpl.invoke(DelegatingMethodAccessorImpl.java:43)
	at java.lang.reflect.Method.invoke(Method.java:498)
	at org.codehaus.groovy.reflection.CachedMethod.invoke(CachedMethod.java:93)
	at groovy.lang.MetaMethod.doMethodInvoke(MetaMethod.java:325)
	at groovy.lang.MetaClassImpl.invokeMethod(MetaClassImpl.java:1213)
	at org.codehaus.groovy.runtime.ScriptBytecodeAdapter.invokeMethodOnSuperN(ScriptBytecodeAdapter.java:132)
	at com.netflix.spinnaker.gate.retrofit.EurekaOkClient.execute(EurekaOkClient.groovy:82)
	at retrofit.RestAdapter$RestHandler.invokeRequest(RestAdapter.java:326)
	at retrofit.RestAdapter$RestHandler.invoke(RestAdapter.java:240)
	at com.sun.proxy.$Proxy104.getAllApplications(Unknown Source)
	at com.netflix.spinnaker.gate.services.ApplicationService$Front50ApplicationListRetriever$_call_closure1$_closure3.doCall(ApplicationService.groovy:272)
	at com.netflix.spinnaker.gate.services.ApplicationService$Front50ApplicationListRetriever$_call_closure1$_closure3.call(ApplicationService.groovy)
	at com.netflix.spinnaker.security.AuthenticatedRequest.lambda$propagate$0(AuthenticatedRequest.java:57)
	at com.netflix.spinnaker.gate.services.ApplicationService$Front50ApplicationListRetriever$_call_closure1.doCall(ApplicationService.groovy:270)
	at com.netflix.spinnaker.gate.services.ApplicationService$Front50ApplicationListRetriever$_call_closure1.call(ApplicationService.groovy)
	at com.netflix.spinnaker.security.AuthenticatedRequest.lambda$propagate$0(AuthenticatedRequest.java:57)
	at com.netflix.spinnaker.gate.services.commands.AbstractHystrixCommand.run(AbstractHystrixCommand.groovy:57)
	at com.netflix.hystrix.HystrixCommand$1.call(HystrixCommand.java:294)
	at com.netflix.hystrix.HystrixCommand$1.call(HystrixCommand.java:289)
	at rx.Observable$2.call(Observable.java:162)
	at rx.Observable$2.call(Observable.java:154)
	at rx.Observable$2.call(Observable.java:162)
	at rx.Observable$2.call(Observable.java:154)
	at rx.Observable$2.call(Observable.java:162)
	at rx.Observable$2.call(Observable.java:154)
	at rx.Observable.unsafeSubscribe(Observable.java:8171)
	at com.netflix.hystrix.AbstractCommand$5.call(AbstractCommand.java:520)
	at com.netflix.hystrix.AbstractCommand$5.call(AbstractCommand.java:495)
	at rx.Observable.unsafeSubscribe(Observable.java:8171)
	at rx.internal.operators.OperatorSubscribeOn$1$1.call(OperatorSubscribeOn.java:62)
	at com.netflix.hystrix.strategy.concurrency.HystrixContexSchedulerAction$1.call(HystrixContexSchedulerAction.java:56)
	at com.netflix.hystrix.strategy.concurrency.HystrixContexSchedulerAction$1.call(HystrixContexSchedulerAction.java:47)
	at com.netflix.hystrix.strategy.concurrency.HystrixContexSchedulerAction.call(HystrixContexSchedulerAction.java:69)
	at rx.internal.schedulers.ScheduledAction.run(ScheduledAction.java:55)
	at java.util.concurrent.Executors$RunnableAdapter.call(Executors.java:511)
	at java.util.concurrent.FutureTask.run(FutureTask.java:266)
	at java.util.concurrent.ThreadPoolExecutor.runWorker(ThreadPoolExecutor.java:1149)
	at java.util.concurrent.ThreadPoolExecutor$Worker.run(ThreadPoolExecutor.java:624)
	at java.lang.Thread.run(Thread.java:748)
Caused by: java.net.SocketException: Socket closed
	at java.net.SocketInputStream.read(SocketInputStream.java:204)
	at java.net.SocketInputStream.read(SocketInputStream.java:141)
	at okio.Okio$2.read(Okio.java:139)
	at okio.AsyncTimeout$2.read(AsyncTimeout.java:211)
	... 55 more

2017-10-18 09:33:50.116  INFO 2533 --- [-applications-7] c.n.s.g.s.internal.Front50Service        : ---- END ERROR
2017-10-18 09:33:54.905  INFO 2533 --- [-applications-9] c.n.s.g.s.internal.Front50Service        : ---- ERROR http://localhost:8080/v2/applications
2017-10-18 09:33:54.905  INFO 2533 --- [-applications-9] c.n.s.g.s.internal.Front50Service        : java.net.SocketTimeoutException: timeout
	at okio.Okio$3.newTimeoutException(Okio.java:207)
	at okio.AsyncTimeout.exit(AsyncTimeout.java:261)
	at okio.AsyncTimeout$2.read(AsyncTimeout.java:215)
	at okio.RealBufferedSource.indexOf(RealBufferedSource.java:306)
	at okio.RealBufferedSource.indexOf(RealBufferedSource.java:300)
	at okio.RealBufferedSource.readUtf8LineStrict(RealBufferedSource.java:196)
	at com.squareup.okhttp.internal.http.Http1xStream.readResponse(Http1xStream.java:186)
	at com.squareup.okhttp.internal.http.Http1xStream.readResponseHeaders(Http1xStream.java:127)
	at com.squareup.okhttp.internal.http.HttpEngine.readNetworkResponse(HttpEngine.java:739)
	at com.squareup.okhttp.internal.http.HttpEngine.access$200(HttpEngine.java:87)
	at com.squareup.okhttp.internal.http.HttpEngine$NetworkInterceptorChain.proceed(HttpEngine.java:724)
	at com.squareup.okhttp.internal.http.HttpEngine.readResponse(HttpEngine.java:578)
	at com.squareup.okhttp.Call.getResponse(Call.java:287)
	at com.squareup.okhttp.Call$ApplicationInterceptorChain.proceed(Call.java:243)
	at com.squareup.okhttp.Call.getResponseWithInterceptorChain(Call.java:205)
	at com.squareup.okhttp.Call.execute(Call.java:80)
	at retrofit.client.OkClient.execute(OkClient.java:53)
	at com.netflix.spinnaker.gate.retrofit.EurekaOkClient.super$2$execute(EurekaOkClient.groovy)
	at sun.reflect.GeneratedMethodAccessor136.invoke(Unknown Source)
	at sun.reflect.DelegatingMethodAccessorImpl.invoke(DelegatingMethodAccessorImpl.java:43)
	at java.lang.reflect.Method.invoke(Method.java:498)
	at org.codehaus.groovy.reflection.CachedMethod.invoke(CachedMethod.java:93)
	at groovy.lang.MetaMethod.doMethodInvoke(MetaMethod.java:325)
	at groovy.lang.MetaClassImpl.invokeMethod(MetaClassImpl.java:1213)
	at org.codehaus.groovy.runtime.ScriptBytecodeAdapter.invokeMethodOnSuperN(ScriptBytecodeAdapter.java:132)
	at com.netflix.spinnaker.gate.retrofit.EurekaOkClient.execute(EurekaOkClient.groovy:82)
	at retrofit.RestAdapter$RestHandler.invokeRequest(RestAdapter.java:326)
	at retrofit.RestAdapter$RestHandler.invoke(RestAdapter.java:240)
	at com.sun.proxy.$Proxy104.getAllApplications(Unknown Source)
	at com.netflix.spinnaker.gate.services.ApplicationService$Front50ApplicationListRetriever$_call_closure1$_closure3.doCall(ApplicationService.groovy:272)
	at com.netflix.spinnaker.gate.services.ApplicationService$Front50ApplicationListRetriever$_call_closure1$_closure3.call(ApplicationService.groovy)
	at com.netflix.spinnaker.security.AuthenticatedRequest.lambda$propagate$1(AuthenticatedRequest.java:72)
	at com.netflix.spinnaker.gate.services.ApplicationService$Front50ApplicationListRetriever$_call_closure1.doCall(ApplicationService.groovy:270)
	at com.netflix.spinnaker.gate.services.ApplicationService$Front50ApplicationListRetriever$_call_closure1.call(ApplicationService.groovy)
	at com.netflix.spinnaker.security.AuthenticatedRequest.lambda$propagate$0(AuthenticatedRequest.java:57)
	at com.netflix.spinnaker.gate.services.commands.AbstractHystrixCommand.run(AbstractHystrixCommand.groovy:57)
	at com.netflix.hystrix.HystrixCommand$1.call(HystrixCommand.java:294)
	at com.netflix.hystrix.HystrixCommand$1.call(HystrixCommand.java:289)
	at rx.Observable$2.call(Observable.java:162)
	at rx.Observable$2.call(Observable.java:154)
	at rx.Observable$2.call(Observable.java:162)
	at rx.Observable$2.call(Observable.java:154)
	at rx.Observable$2.call(Observable.java:162)
	at rx.Observable$2.call(Observable.java:154)
	at rx.Observable.unsafeSubscribe(Observable.java:8171)
	at com.netflix.hystrix.AbstractCommand$5.call(AbstractCommand.java:520)
	at com.netflix.hystrix.AbstractCommand$5.call(AbstractCommand.java:495)
	at rx.Observable.unsafeSubscribe(Observable.java:8171)
	at rx.internal.operators.OperatorSubscribeOn$1$1.call(OperatorSubscribeOn.java:62)
	at com.netflix.hystrix.strategy.concurrency.HystrixContexSchedulerAction$1.call(HystrixContexSchedulerAction.java:56)
	at com.netflix.hystrix.strategy.concurrency.HystrixContexSchedulerAction$1.call(HystrixContexSchedulerAction.java:47)
	at com.netflix.hystrix.strategy.concurrency.HystrixContexSchedulerAction.call(HystrixContexSchedulerAction.java:69)
	at rx.internal.schedulers.ScheduledAction.run(ScheduledAction.java:55)
	at java.util.concurrent.Executors$RunnableAdapter.call(Executors.java:511)
	at java.util.concurrent.FutureTask.run(FutureTask.java:266)
	at java.util.concurrent.ThreadPoolExecutor.runWorker(ThreadPoolExecutor.java:1149)
	at java.util.concurrent.ThreadPoolExecutor$Worker.run(ThreadPoolExecutor.java:624)
	at java.lang.Thread.run(Thread.java:748)
Caused by: java.net.SocketException: Socket closed
	at java.net.SocketInputStream.read(SocketInputStream.java:204)
	at java.net.SocketInputStream.read(SocketInputStream.java:141)
	at okio.Okio$2.read(Okio.java:139)
	at okio.AsyncTimeout$2.read(AsyncTimeout.java:211)
	... 55 more

2017-10-18 09:33:54.906  INFO 2533 --- [-applications-9] c.n.s.g.s.internal.Front50Service        : ---- END ERROR`

**orca.log**
2017-10-18 09:35:17.764  INFO 15096 --- [0.1-8083-exec-8] c.n.s.orca.front50.Front50Service        : [anonymous] ---- ERROR http://localhost:8080/pipelines/test-application-01?refresh=false
2017-10-18 09:35:17.768  INFO 15096 --- [0.1-8083-exec-8] c.n.s.orca.front50.Front50Service        : [anonymous] java.net.SocketTimeoutException: timeout
	at okio.Okio$3.newTimeoutException(Okio.java:207)
	at okio.AsyncTimeout.exit(AsyncTimeout.java:261)
	at okio.AsyncTimeout$2.read(AsyncTimeout.java:215)
	at okio.RealBufferedSource.indexOf(RealBufferedSource.java:306)
	at okio.RealBufferedSource.indexOf(RealBufferedSource.java:300)
	at okio.RealBufferedSource.readUtf8LineStrict(RealBufferedSource.java:196)
	at com.squareup.okhttp.internal.http.Http1xStream.readResponse(Http1xStream.java:186)
	at com.squareup.okhttp.internal.http.Http1xStream.readResponseHeaders(Http1xStream.java:127)
	at com.squareup.okhttp.internal.http.HttpEngine.readNetworkResponse(HttpEngine.java:739)
	at com.squareup.okhttp.internal.http.HttpEngine.access$200(HttpEngine.java:87)
	at com.squareup.okhttp.internal.http.HttpEngine$NetworkInterceptorChain.proceed(HttpEngine.java:724)
	at com.netflix.spinnaker.orca.retrofit.RetrofitConfiguration$1.intercept(RetrofitConfiguration.groovy:64)
	at com.squareup.okhttp.internal.http.HttpEngine$NetworkInterceptorChain.proceed(HttpEngine.java:697)
	at com.squareup.okhttp.internal.http.HttpEngine.readResponse(HttpEngine.java:578)
	at com.squareup.okhttp.Call.getResponse(Call.java:287)
	at com.squareup.okhttp.Call$ApplicationInterceptorChain.proceed(Call.java:243)
	at com.squareup.okhttp.Call.getResponseWithInterceptorChain(Call.java:205)
	at com.squareup.okhttp.Call.execute(Call.java:80)
	at retrofit.client.OkClient.execute(OkClient.java:53)
	at retrofit.RestAdapter$RestHandler.invokeRequest(RestAdapter.java:326)
	at retrofit.RestAdapter$RestHandler.invoke(RestAdapter.java:240)
	at com.sun.proxy.$Proxy102.getPipelines(Unknown Source)
	at com.netflix.spinnaker.orca.front50.Front50Service$getPipelines.call(Unknown Source)
	at com.netflix.spinnaker.orca.controllers.TaskController.getPipelinesForApplication(TaskController.groovy:317)
	at com.netflix.spinnaker.orca.controllers.TaskController.getApplicationPipelines(TaskController.groovy:295)
	at com.netflix.spinnaker.orca.controllers.TaskController$$FastClassBySpringCGLIB$$7254ba71.invoke(<generated>)
	at org.springframework.cglib.proxy.MethodProxy.invoke(MethodProxy.java:204)
	at org.springframework.aop.framework.CglibAopProxy$CglibMethodInvocation.invokeJoinpoint(CglibAopProxy.java:738)
	at org.springframework.aop.framework.ReflectiveMethodInvocation.proceed(ReflectiveMethodInvocation.java:157)
	at org.springframework.security.access.intercept.aopalliance.MethodSecurityInterceptor.invoke(MethodSecurityInterceptor.java:69)
	at org.springframework.aop.framework.ReflectiveMethodInvocation.proceed(ReflectiveMethodInvocation.java:179)
	at org.springframework.aop.framework.CglibAopProxy$DynamicAdvisedInterceptor.intercept(CglibAopProxy.java:673)
	at com.netflix.spinnaker.orca.controllers.TaskController$$EnhancerBySpringCGLIB$$b71c37c0.getApplicationPipelines(<generated>)
	at sun.reflect.GeneratedMethodAccessor151.invoke(Unknown Source)
	at sun.reflect.DelegatingMethodAccessorImpl.invoke(DelegatingMethodAccessorImpl.java:43)
	at java.lang.reflect.Method.invoke(Method.java:498)
	at org.springframework.web.method.support.InvocableHandlerMethod.doInvoke(InvocableHandlerMethod.java:205)
	at org.springframework.web.method.support.InvocableHandlerMethod.invokeForRequest(InvocableHandlerMethod.java:133)
	at org.springframework.web.servlet.mvc.method.annotation.ServletInvocableHandlerMethod.invokeAndHandle(ServletInvocableHandlerMethod.java:97)
	at org.springframework.web.servlet.mvc.method.annotation.RequestMappingHandlerAdapter.invokeHandlerMethod(RequestMappingHandlerAdapter.java:827)
	at org.springframework.web.servlet.mvc.method.annotation.RequestMappingHandlerAdapter.handleInternal(RequestMappingHandlerAdapter.java:738)
	at org.springframework.web.servlet.mvc.method.AbstractHandlerMethodAdapter.handle(AbstractHandlerMethodAdapter.java:85)
	at org.springframework.web.servlet.DispatcherServlet.doDispatch(DispatcherServlet.java:967)
	at org.springframework.web.servlet.DispatcherServlet.doService(DispatcherServlet.java:901)
	at org.springframework.web.servlet.FrameworkServlet.processRequest(FrameworkServlet.java:970)
	at org.springframework.web.servlet.FrameworkServlet.doGet(FrameworkServlet.java:861)
	at javax.servlet.http.HttpServlet.service(HttpServlet.java:635)
	at org.springframework.web.servlet.FrameworkServlet.service(FrameworkServlet.java:846)
	at javax.servlet.http.HttpServlet.service(HttpServlet.java:742)
	at org.apache.catalina.core.ApplicationFilterChain.internalDoFilter(ApplicationFilterChain.java:231)
	at org.apache.catalina.core.ApplicationFilterChain.doFilter(ApplicationFilterChain.java:166)
	at org.apache.tomcat.websocket.server.WsFilter.doFilter(WsFilter.java:52)
	at org.apache.catalina.core.ApplicationFilterChain.internalDoFilter(ApplicationFilterChain.java:193)
	at org.apache.catalina.core.ApplicationFilterChain.doFilter(ApplicationFilterChain.java:166)
	at org.springframework.boot.web.filter.ApplicationContextHeaderFilter.doFilterInternal(ApplicationContextHeaderFilter.java:55)
	at org.springframework.web.filter.OncePerRequestFilter.doFilter(OncePerRequestFilter.java:107)
	at org.apache.catalina.core.ApplicationFilterChain.internalDoFilter(ApplicationFilterChain.java:193)
	at org.apache.catalina.core.ApplicationFilterChain.doFilter(ApplicationFilterChain.java:166)
	at com.netflix.spinnaker.orca.web.config.WebConfiguration$1.doFilter(WebConfiguration.groovy:75)
	at org.apache.catalina.core.ApplicationFilterChain.internalDoFilter(ApplicationFilterChain.java:193)
	at org.apache.catalina.core.ApplicationFilterChain.doFilter(ApplicationFilterChain.java:166)
	at org.springframework.boot.actuate.trace.WebRequestTraceFilter.doFilterInternal(WebRequestTraceFilter.java:110)
	at org.springframework.web.filter.OncePerRequestFilter.doFilter(OncePerRequestFilter.java:107)
	at org.apache.catalina.core.ApplicationFilterChain.internalDoFilter(ApplicationFilterChain.java:193)
	at org.apache.catalina.core.ApplicationFilterChain.doFilter(ApplicationFilterChain.java:166)
	at org.springframework.security.web.FilterChainProxy$VirtualFilterChain.doFilter(FilterChainProxy.java:317)
	at org.springframework.security.web.access.intercept.FilterSecurityInterceptor.invoke(FilterSecurityInterceptor.java:127)
	at org.springframework.security.web.access.intercept.FilterSecurityInterceptor.doFilter(FilterSecurityInterceptor.java:91)
	at org.springframework.security.web.FilterChainProxy$VirtualFilterChain.doFilter(FilterChainProxy.java:331)
	at org.springframework.security.web.access.ExceptionTranslationFilter.doFilter(ExceptionTranslationFilter.java:114)
	at org.springframework.security.web.FilterChainProxy$VirtualFilterChain.doFilter(FilterChainProxy.java:331)
	at org.springframework.security.web.session.SessionManagementFilter.doFilter(SessionManagementFilter.java:137)
	at org.springframework.security.web.FilterChainProxy$VirtualFilterChain.doFilter(FilterChainProxy.java:331)
	at org.springframework.security.web.authentication.AnonymousAuthenticationFilter.doFilter(AnonymousAuthenticationFilter.java:111)
	at org.springframework.security.web.FilterChainProxy$VirtualFilterChain.doFilter(FilterChainProxy.java:331)
	at org.springframework.security.web.servletapi.SecurityContextHolderAwareRequestFilter.doFilter(SecurityContextHolderAwareRequestFilter.java:170)
	at org.springframework.security.web.FilterChainProxy$VirtualFilterChain.doFilter(FilterChainProxy.java:331)
	at org.springframework.security.web.savedrequest.RequestCacheAwareFilter.doFilter(RequestCacheAwareFilter.java:63)
	at org.springframework.security.web.FilterChainProxy$VirtualFilterChain.doFilter(FilterChainProxy.java:331)
	at org.springframework.security.web.authentication.logout.LogoutFilter.doFilter(LogoutFilter.java:116)
	at org.springframework.security.web.FilterChainProxy$VirtualFilterChain.doFilter(FilterChainProxy.java:331)
	at org.springframework.security.web.header.HeaderWriterFilter.doFilterInternal(HeaderWriterFilter.java:64)
	at org.springframework.web.filter.OncePerRequestFilter.doFilter(OncePerRequestFilter.java:107)
	at org.springframework.security.web.FilterChainProxy$VirtualFilterChain.doFilter(FilterChainProxy.java:331)
	at org.springframework.security.web.context.SecurityContextPersistenceFilter.doFilter(SecurityContextPersistenceFilter.java:105)
	at org.springframework.security.web.FilterChainProxy$VirtualFilterChain.doFilter(FilterChainProxy.java:331)
	at org.springframework.security.web.context.request.async.WebAsyncManagerIntegrationFilter.doFilterInternal(WebAsyncManagerIntegrationFilter.java:56)
	at org.springframework.web.filter.OncePerRequestFilter.doFilter(OncePerRequestFilter.java:107)
	at org.springframework.security.web.FilterChainProxy$VirtualFilterChain.doFilter(FilterChainProxy.java:331)
	at org.springframework.security.web.FilterChainProxy.doFilterInternal(FilterChainProxy.java:214)
	at org.springframework.security.web.FilterChainProxy.doFilter(FilterChainProxy.java:177)
	at org.springframework.web.filter.DelegatingFilterProxy.invokeDelegate(DelegatingFilterProxy.java:346)
	at org.springframework.web.filter.DelegatingFilterProxy.doFilter(DelegatingFilterProxy.java:262)
	at org.apache.catalina.core.ApplicationFilterChain.internalDoFilter(ApplicationFilterChain.java:193)
	at org.apache.catalina.core.ApplicationFilterChain.doFilter(ApplicationFilterChain.java:166)
	at org.springframework.web.filter.RequestContextFilter.doFilterInternal(RequestContextFilter.java:99)
	at org.springframework.web.filter.OncePerRequestFilter.doFilter(OncePerRequestFilter.java:107)
	at org.apache.catalina.core.ApplicationFilterChain.internalDoFilter(ApplicationFilterChain.java:193)
	at org.apache.catalina.core.ApplicationFilterChain.doFilter(ApplicationFilterChain.java:166)
	at org.springframework.web.filter.HttpPutFormContentFilter.doFilterInternal(HttpPutFormContentFilter.java:105)
	at org.springframework.web.filter.OncePerRequestFilter.doFilter(OncePerRequestFilter.java:107)
	at org.apache.catalina.core.ApplicationFilterChain.internalDoFilter(ApplicationFilterChain.java:193)
	at org.apache.catalina.core.ApplicationFilterChain.doFilter(ApplicationFilterChain.java:166)
	at org.springframework.web.filter.HiddenHttpMethodFilter.doFilterInternal(HiddenHttpMethodFilter.java:81)
	at org.springframework.web.filter.OncePerRequestFilter.doFilter(OncePerRequestFilter.java:107)
	at org.apache.catalina.core.ApplicationFilterChain.internalDoFilter(ApplicationFilterChain.java:193)
	at org.apache.catalina.core.ApplicationFilterChain.doFilter(ApplicationFilterChain.java:166)
	at com.netflix.spinnaker.fiat.shared.FiatAuthenticationFilter.doFilter(FiatAuthenticationFilter.java:54)
	at org.apache.catalina.core.ApplicationFilterChain.internalDoFilter(ApplicationFilterChain.java:193)
	at org.apache.catalina.core.ApplicationFilterChain.doFilter(ApplicationFilterChain.java:166)
	at org.springframework.web.filter.CharacterEncodingFilter.doFilterInternal(CharacterEncodingFilter.java:197)
	at org.springframework.web.filter.OncePerRequestFilter.doFilter(OncePerRequestFilter.java:107)
	at org.apache.catalina.core.ApplicationFilterChain.internalDoFilter(ApplicationFilterChain.java:193)
	at org.apache.catalina.core.ApplicationFilterChain.doFilter(ApplicationFilterChain.java:166)
	at org.springframework.boot.actuate.autoconfigure.MetricsFilter.doFilterInternal(MetricsFilter.java:106)
	at org.springframework.web.filter.OncePerRequestFilter.doFilter(OncePerRequestFilter.java:107)
	at org.apache.catalina.core.ApplicationFilterChain.internalDoFilter(ApplicationFilterChain.java:193)
	at org.apache.catalina.core.ApplicationFilterChain.doFilter(ApplicationFilterChain.java:166)
	at javax.servlet.FilterChain$doFilter.call(Unknown Source)
	at com.netflix.spinnaker.filters.AuthenticatedRequestFilter.doFilter(AuthenticatedRequestFilter.groovy:118)
	at org.apache.catalina.core.ApplicationFilterChain.internalDoFilter(ApplicationFilterChain.java:193)
	at org.apache.catalina.core.ApplicationFilterChain.doFilter(ApplicationFilterChain.java:166)
	at org.apache.catalina.core.StandardWrapperValve.invoke(StandardWrapperValve.java:198)
	at org.apache.catalina.core.StandardContextValve.invoke(StandardContextValve.java:96)
	at org.apache.catalina.authenticator.AuthenticatorBase.invoke(AuthenticatorBase.java:478)
	at org.apache.catalina.core.StandardHostValve.invoke(StandardHostValve.java:140)
	at org.apache.catalina.valves.ErrorReportValve.invoke(ErrorReportValve.java:80)
	at org.apache.catalina.core.StandardEngineValve.invoke(StandardEngineValve.java:87)
	at org.apache.catalina.connector.CoyoteAdapter.service(CoyoteAdapter.java:342)
	at org.apache.coyote.http11.Http11Processor.service(Http11Processor.java:799)
	at org.apache.coyote.AbstractProcessorLight.process(AbstractProcessorLight.java:66)
	at org.apache.coyote.AbstractProtocol$ConnectionHandler.process(AbstractProtocol.java:861)
	at org.apache.tomcat.util.net.NioEndpoint$SocketProcessor.doRun(NioEndpoint.java:1455)
	at org.apache.tomcat.util.net.SocketProcessorBase.run(SocketProcessorBase.java:49)
	at java.util.concurrent.ThreadPoolExecutor.runWorker(ThreadPoolExecutor.java:1149)
	at java.util.concurrent.ThreadPoolExecutor$Worker.run(ThreadPoolExecutor.java:624)
	at org.apache.tomcat.util.threads.TaskThread$WrappingRunnable.run(TaskThread.java:61)
	at java.lang.Thread.run(Thread.java:748)
Caused by: java.net.SocketException: Socket closed
	at java.net.SocketInputStream.read(SocketInputStream.java:204)
	at java.net.SocketInputStream.read(SocketInputStream.java:141)
	at okio.Okio$2.read(Okio.java:139)
	at okio.AsyncTimeout$2.read(AsyncTimeout.java:211)
	... 135 more

2017-10-18 09:35:17.773  INFO 15096 --- [0.1-8083-exec-8] c.n.s.orca.front50.Front50Service        : [anonymous] ---- END ERROR

**echo.log**
`---- ERROR http://localhost:8080/pipelines?restricted=false
java.net.SocketTimeoutException: timeout
	at okio.Okio$3.newTimeoutException(Okio.java:207)
	at okio.AsyncTimeout.exit(AsyncTimeout.java:261)
	at okio.AsyncTimeout$2.read(AsyncTimeout.java:215)
	at okio.RealBufferedSource.indexOf(RealBufferedSource.java:306)
	at okio.RealBufferedSource.indexOf(RealBufferedSource.java:300)
	at okio.RealBufferedSource.readUtf8LineStrict(RealBufferedSource.java:196)
	at com.squareup.okhttp.internal.http.Http1xStream.readResponse(Http1xStream.java:186)
	at com.squareup.okhttp.internal.http.Http1xStream.readResponseHeaders(Http1xStream.java:127)
	at com.squareup.okhttp.internal.http.HttpEngine.readNetworkResponse(HttpEngine.java:739)
	at com.squareup.okhttp.internal.http.HttpEngine.access$200(HttpEngine.java:87)
	at com.squareup.okhttp.internal.http.HttpEngine$NetworkInterceptorChain.proceed(HttpEngine.java:724)
	at com.squareup.okhttp.internal.http.HttpEngine.readResponse(HttpEngine.java:578)
	at com.squareup.okhttp.Call.getResponse(Call.java:287)
	at com.squareup.okhttp.Call$ApplicationInterceptorChain.proceed(Call.java:243)
	at com.squareup.okhttp.Call.getResponseWithInterceptorChain(Call.java:205)
	at com.squareup.okhttp.Call.execute(Call.java:80)
	at retrofit.client.OkClient.execute(OkClient.java:53)
	at retrofit.RestAdapter$RestHandler.invokeRequest(RestAdapter.java:326)
	at retrofit.RestAdapter$RestHandler.access$100(RestAdapter.java:220)
	at retrofit.RestAdapter$RestHandler$1.invoke(RestAdapter.java:265)
	at retrofit.RxSupport$2.run(RxSupport.java:55)
	at java.util.concurrent.Executors$RunnableAdapter.call(Executors.java:511)
	at java.util.concurrent.FutureTask.run(FutureTask.java:266)
	at java.util.concurrent.ThreadPoolExecutor.runWorker(ThreadPoolExecutor.java:1149)
	at java.util.concurrent.ThreadPoolExecutor$Worker.run(ThreadPoolExecutor.java:624)
	at retrofit.Platform$Base$2$1.run(Platform.java:94)
	at java.lang.Thread.run(Thread.java:748)
Caused by: java.net.SocketException: Socket closed
	at java.net.SocketInputStream.read(SocketInputStream.java:204)
	at java.net.SocketInputStream.read(SocketInputStream.java:141)
	at okio.Okio$2.read(Okio.java:139)
	at okio.AsyncTimeout$2.read(AsyncTimeout.java:211)
	... 24 more

---- END ERROR
---> HTTP GET http://localhost:8080/pipelines?restricted=false`


And I got some strange messages on debug mode from front50's log.

**front50.log**
`2017-10-18 09:08:39.242 DEBUG 16638 --- [0-8080-exec-101] o.s.b.a.e.mvc.EndpointHandlerMapping     : Did not find handler method for [/v2/applications]
2017-10-18 09:08:45.023 DEBUG 16638 --- [0-8080-exec-103] o.s.b.a.e.mvc.EndpointHandlerMapping     : Did not find handler method for [/pipelines]
2017-10-18 09:08:54.729 DEBUG 16638 --- [0-8080-exec-105] o.s.b.a.e.mvc.EndpointHandlerMapping     : Did not find handler method for [/credentials]
2017-10-18 09:08:55.028 DEBUG 16638 --- [0-8080-exec-104] o.s.b.a.e.mvc.EndpointHandlerMapping     : Did not find handler method for [/pipelines]`

Please help us.

**Comment by DaspawnW** [comment]
Same here... error on getting pipelines

**Comment by hyunto** [comment]
@DaspawnW How about change storage from redis to another?
I can solve it to change the storage type to s3 that using [minio](https://www.minio.io/).
(I mentioned about it on slack)
In my case, front50 using redis doesn't reply any requests. So another micro services occured socket timeout exception from front50.

**Comment by bernardoVale** [comment]
@hyunto I'm using Azure so I don't think its a Redis problem.

**Comment by hyunto** [comment]
@bernardoVale Does you use the Azure Storage as a backend storage of front50?
I mean that @DaspawnW should change the storage type of front50 because he uses the redis as a backend storage.
When i install spinnaker on my local VM with Azure as a cloudprovider and use redis as a backend storage, I suffer same issue that front50 does not response.

**Comment by emptywee** [comment]
I don't think it's Azure related. I have a self-hosted k8s cluster, minio as a backend s3 storage, redis disabled for front50 (I don't also think it was ever using it, though), same problem. Gate with a default read timeout (non configurable, seems like, from any of .yml files) of 10s (httpok defaults) disconnects from front50 if it doesn't receive any response within those 10s. And it is not clear what front50 is doing. I was taking tcpdump and also tracking nginx logs that is my reverse proxy to minio. Minio showed response time of fractures of a second, but those requests were coming with a huge delay after the initial request to front50 had been made by the client.

tcpdump showed the following:
```
15:35:24.466932 IP 10.148.223.29.45346 > 10.148.139.61.8080: Flags [P.], seq 1569:1757, ack 35171, win 974, options [nop,nop,TS val 3390017952 ecr 1620209927], length 188: HTTP: GET /pipelines/testapplication3?refresh=true HTTP/1.1
15:35:24.467243 IP 10.148.139.61.8080 > 10.148.223.29.45346: Flags [.], ack 1757, win 303, options [nop,nop,TS val 1620211044 ecr 3390017952], length 0
15:35:42.062321 IP 10.148.139.61.8080 > 10.148.223.29.45346: Flags [P.], seq 35171:36333, ack 1757, win 303, options [nop,nop,TS val 1620228639 ecr 3390017952], length 1162: HTTP: HTTP/1.1 200
15:35:42.062675 IP 10.148.223.29.45346 > 10.148.139.61.8080: Flags [.], ack 36333, win 996, options [nop,nop,TS val 3390035547 ecr 1620228639], length 0
15:35:42.062943 IP 10.148.139.61.8080 > 10.148.223.29.45346: Flags [P.], seq 36333:36338, ack 1757, win 303, options [nop,nop,TS val 1620228639 ecr 3390035547], length 5: HTTP
15:35:42.063414 IP 10.148.223.29.45346 > 10.148.139.61.8080: Flags [.], ack 36338, win 996, options [nop,nop,TS val 3390035548 ecr 1620228639], length 0
15:35:43.169654 IP 10.148.223.29.45346 > 10.148.139.61.8080: Flags [P.], seq 1757:1945, ack 36338, win 996, options [nop,nop,TS val 3390036654 ecr 1620228639], length 188: HTTP: GET /pipelines/testapplication3?refresh=true HTTP/1.1
15:35:43.169762 IP 10.148.139.61.8080 > 10.148.223.29.45346: Flags [.], ack 1945, win 311, options [nop,nop,TS val 1620229746 ecr 3390036654], length 0
15:36:03.174174 IP 10.148.223.29.45346 > 10.148.139.61.8080: Flags [F.], seq 1945, ack 36338, win 996, options [nop,nop,TS val 3390056655 ecr 1620229746], length 0
15:36:03.215062 IP 10.148.139.61.8080 > 10.148.223.29.45346: Flags [.], ack 1946, win 311, options [nop,nop,TS val 1620249792 ecr 3390056655], length 0
15:36:06.323464 IP 10.148.139.61.8080 > 10.148.223.29.45346: Flags [P.], seq 36338:37772, ack 1946, win 311, options [nop,nop,TS val 1620252900 ecr 3390056655], length 1434: HTTP: HTTP/1.1 200
15:36:06.323959 IP 10.148.223.29.45346 > 10.148.139.61.8080: Flags [R], seq 4148027505, win 0, length 0
```
Look at the time stamps how soon front50 responded with data. Gate was already posting exceptions about timeouts at that time, and eventually just decided to close the connection. Then responded with TCP RST, because it was received after the FIN it sent out.

I tried to play with hystrix coreSize for front50, but no luck. It's very unclear what front50 is doing during such delays. Sometimes it responds fast, sometimes it takes a while for it to respond.

**Comment by uvoigt** [comment]
It seems like for a different reason but in my environment with Redis I see the same java.net.SocketException in the spin-gate log.
front50 gets into a situation where all worker threads are blocked waiting for a Redis connection. 
This might be solved by a certain configuration of the Apache connection pool which is used by the Jedis connection pool as mentioned in https://github.com/xetorthio/jedis/issues/1620
But still I could not solve it.
Unfortunately it seems impossible to define multiple Java system properties by using 
```
env:
  JAVA_TOOL_OPTIONS: -Dlogging.level.org.springframework=DEBUG -Dspring.datasource.borrowMaxWaitMillis=0
```
within service-setting/front50.yml
I suspect that the space is a problem, but not sure about this. It might be a bug.

**Comment by spinnakerbot** [comment]
This issue is tagged as 'stale' and hasn't been updated  in 82 days, so we are tagging it as 'to-be-closed'. It will be closed in 45 days unless updates are made. If you want to remove this label, comment:

> @spinnakerbot remove-label to-be-closed

**Comment by spinnakerbot** [comment]
This issue is tagged as 'to-be-closed' and hasn't been updated  in 45 days, so we are closing it. You can always reopen this issue if needed.

**Comment by arikkfir** [comment]
Adding this in case it helps someone - I had a similar problem, which was solved when I upgraded my instance from a 2-CPU 7.5GB to a 4-CPU 15GB machine (for me it was on GCP)
